,App,Translated_Review,Sentiment,Sentiment_Subjectivity
11,10 Best Foods for You,"Useful information The amount spelling errors questions validity information shared. Once fixed, 5 stars given.",Positive,0.1
18,10 Best Foods for You,Very Useful in diabetes age 30. I need control sugar. thanks,Positive,0.1
43,10 Best Foods for You,Waste time It needs internet time n ask calls information,Negative,0.0
44,10 Best Foods for You,Best thing I lost ten lbs. two months help tips,Positive,0.15
48,10 Best Foods for You,A big thanks ds I got bst gd health,Positive,0.15000000000000002
58,10 Best Foods for You,Very useful,Positive,0.0
68,10 Best Foods for You,Faltu plz waste ur time,Negative,0.0
111,10 Best Foods for You,"Useful information The amount spelling errors questions validity information shared. Once fixed, 5 stars given.",Positive,0.1
118,10 Best Foods for You,Very Useful in diabetes age 30. I need control sugar. thanks,Positive,0.1
143,10 Best Foods for You,Waste time It needs internet time n ask calls information,Negative,0.0
144,10 Best Foods for You,Best thing I lost ten lbs. two months help tips,Positive,0.15
148,10 Best Foods for You,A big thanks ds I got bst gd health,Positive,0.15000000000000002
158,10 Best Foods for You,Very useful,Positive,0.0
168,10 Best Foods for You,Faltu plz waste ur time,Negative,0.0
213,104 找工作 - 找工作 找打工 找兼職 履歷健檢 履歷診療室,Very useful,Positive,0.0
233,104 找工作 - 找工作 找打工 找兼職 履歷健檢 履歷診療室,Useful This useful Chinese difficult people's read Chinese. If add English language useful.,Positive,0.14285714285714285
245,11st,There is nothing missing ~ !!!,Negative,0.05
255,11st,Icon name is strange after updating,Negative,0.15
300,1800 Contacts - Lens Store,Does need do. No sense giving anything less 5 stars.,Negative,0.06666666666666668
340,1800 Contacts - Lens Store,Does need do. No sense giving anything less 5 stars.,Negative,0.06666666666666668
402,2018Emoji Keyboard 😂 Emoticons Lite -sticker&gif,It's really useful I really like,Positive,0.1
416,2018Emoji Keyboard 😂 Emoticons Lite -sticker&gif,"last update bug...i can't open keyboard setting, always fc , i'm back old version",Positive,0.19166666666666665
523,"2Date Dating App, Love and matching",Dont waste money become VIP. Tons there. This scam rubbish.,Negative,0.0
532,"2Date Dating App, Love and matching",You can't chat girls without paying premium. Waste time,Negative,0.0
574,2GIS: directory & navigator,It's useful Its helping always find location,Positive,0.0
586,2GIS: directory & navigator,Awesommmmmmmmmm app.. Jst dwnld nd njy.. We nt get trapped anywhr.. Pakka,Negative,0.0
595,2GIS: directory & navigator,It's useful without internet,Positive,0.0
1778,95Live -SG#1 Live Streaming App,I know Chinese wish English version app. This best Google play store!,Positive,0.1
1800,95Live -SG#1 Live Streaming App,Waste people singing English,Negative,0.0
1818,95Live -SG#1 Live Streaming App,I know Chinese wish English version app. This best Google play store!,Positive,0.1
1840,95Live -SG#1 Live Streaming App,Waste people singing English,Negative,0.0
2149,A&E - Watch Full Episodes of TV Shows,Its clear runs smooth...my issue u stop watching show come back later goes directly double long commercial break,Positive,0.13055555555555556
2204,A+ Gallery - Photos & Videos,Alert July 28th contains contain virus gone missing devices might security virus program still remains Google Play store .,Negative,0.05
2253,A+ Gallery - Photos & Videos,It Worth pay,Positive,0.1
2334,A+ Mobile,Its useful balance checks,Positive,0.0
2429,ABC News - US & World News,This spent time rebooting telling movie,Negative,0.1
2437,ABC News - US & World News,Wish could write article propaganda.,Negative,0.1
2451,ABC News - US & World News,"Why can't search interests actually interest you, instead given select might care them? Am I missing something?",Negative,0.07500000000000001
2469,ABC News - US & World News,This spent time rebooting telling movie,Negative,0.1
2477,ABC News - US & World News,Wish could write article propaganda.,Negative,0.1
2491,ABC News - US & World News,"Why can't search interests actually interest you, instead given select might care them? Am I missing something?",Negative,0.07500000000000001
2517,ABC Preschool Free,V useful So gud,Positive,0.0
2555,ABCmouse.com,The needs built screen lock. So kid can't exit back anything right middle cause hit home back button. Our son handsy wants hold tablet. But keeps accidentally pressing back home button. Uninstalling canceling untill added.,Positive,0.10595238095238096
2631,ACE Elite,All banks offering Fingerprint Login. This feature. Missing Basic feature user login without entering Password everytime.,Negative,0.0875
2846,ANA,"It ""failed retrieve international reservations"". My phone language English I Japanese ANA mileage account.",Negative,0.075
2918,AP Mobile - Breaking News,"This brightest news market. A number news allow adjust invert background ease night reading. Two years later, criticism still stands. This really needs give users ability get rid glaring white background",Positive,0.06666666666666668
2977,APE Weather ( Live Forecast),useful,Positive,0.0
2982,"APUS Launcher - Theme, Wallpaper, Hide Apps",Useful app..,Positive,0.0
3002,"APUS Launcher - Theme, Wallpaper, Hide Apps",Sucks! I picture close heart home screen changed it. I never get picture back. I see court ASUS group,Negative,0.15
3037,ARY NEWS,Need improvements. Not professional app.bad ad placement need separated YouTube app.,Negative,0.1
3074,ARY NEWS URDU,"As previous two reviews. Unwatchable , unusable",Negative,0.16666666666666666
3114,ASOS,Can't give five star ever since available English anymore customers Netherlands. Please provide double language choice.,Positive,0.13333333333333333
3154,ASOS,Can't give five star ever since available English anymore customers Netherlands. Please provide double language choice.,Positive,0.13333333333333333
3361,ASUS Sound Recorder,Missing changelog,Negative,0.05
3386,ASUS SuperNote,Unless setup way wants work correctly.,Positive,0.1
3453,"AT&T Navigator: Maps, Traffic",It work. No gps several years. Other map work.,Negative,0.1875
3528,AT&T Visual Voicemail,Well I complaint since I can't sign back everytime I try get operator says unavailable I can't listen voicemail since I can't remember password.,Negative,0.1
3536,AT&T Visual Voicemail,ATT wants pay monthly now. No thanks.,Positive,0.15000000000000002
3633,Account Manager,Phone keeps resetting Since new date phone keeps resetting several times day. Takes ages load back too. I can't YouTube phone anymore phone removes it. Fix please!,Positive,0.15151515151515152
3637,Account Manager,Limited option region/country I consider act racism hatred big brands like u dont give options worldwide. Want get stars add Pakistan country option :@,Negative,0.12142857142857146
3648,Account Manager,"What meaning additional piece software? I never it, I'm forced install using basic stuff phone I've paid for.",Negative,0.1625
3649,Account Manager,If I can't uninstall deserve less star. You force customers,Negative,0.06666666666666668
3682,Accounting App - Zoho Books,Really appreciated account software,Positive,0.1
3683,Accounting App - Zoho Books,Much appreciated never,Positive,0.1
3722,Accounting App - Zoho Books,Really appreciated account software,Positive,0.1
3723,Accounting App - Zoho Books,Much appreciated never,Positive,0.1
3811,Acorn TV: World-class TV from Britain and Beyond,"Paying it, tells I subscriber yet, wants credit card info, I can't find way unsubscribe. Nothing really worth watching anyway. Just want money back too.",Positive,0.06666666666666668
4005,AdWords Express,Work less 30 minutes stoped ad automatically...what hell,Negative,0.06666666666666668
4122,Add Text To Photo,It waste,Negative,0.0
4156,Adobe Acrobat Reader,"Dislike I can't highlight microSD anymore. It forces create local file renders microSD useless. If fixed, l'll go back here, I look better app.",Positive,0.18
4234,Adobe Acrobat Reader,"Dislike I can't highlight microSD anymore. It forces create local file renders microSD useless. If fixed, l'll go back here, I look better app.",Positive,0.18
4284,Adobe Acrobat Reader,This sux saves cloud. Unless im missing something.,Negative,0.05
4296,Adobe Acrobat Reader,Without Adobe reader daily life incomplete. Or complete daily work.,Positive,0.13333333333333333
4298,Adobe Acrobat Reader,"Being student, really useful me. Tried multiple pdf reading coming across one, none could match one.",Positive,0.0
4324,Adobe Photoshop Express:Photo Editor Collage Maker,"Image resize(changing pixels aaa×bbb xxx×yyy) working properly. Changing pixel density ie, 100dpi 80 dpi completely missing.",Negative,0.07500000000000001
4337,Adobe Photoshop Express:Photo Editor Collage Maker,"I used couple years found reasonably useful intuitive, somewhat basic features. However, users forced register ""Adobe ID"" access app'. Since I interest submitting personal information Adobe insisting collecting, I choice delete application.",Negative,0.15625
4499,Advanced Task Killer,"5 stars, 50 stars, 500 stars!!! literally resurrected phone I trash due multiple restarts freezes daily sometimes hourly, runs smoothly occasional lag. Phone restarts since installing using auto kill screen off.",Negative,0.125
4561,Agar.io,In rush mode I 9th I got eaten placed second last remove game,Negative,0.15555555555555556
4658,Agar.io,In rush mode I 9th I got eaten placed second last remove game,Negative,0.15555555555555556
4753,Agoda – Hotel Booking Deals,"Told booking $87, booked, confirmation screen say $87 ($118aud) meaning paid $118 . Wouldve appreciated clear pricing australian hotels aud",Positive,0.1611111111111111
4793,Air Traffic,waste time phone memory. map visible. air traffic showing ever.,Negative,0.0
4804,Air Traffic,"Having clicked plane, altitude heading update real time plane's symbol moves across map. Sometimes toggling 3D mode forces one-off update altitude heading. Also, altitude grey characters everything else visible white?",Positive,0.13333333333333333
4839,AirAsia,"After upgrade new version, im facing problem login Big Loyalty account. It said, username password doesnt match. However, im using Big Loyalty APPS, login using Id password. One thing is, point Airasia BIG LOYALTY doesnt tally",Positive,0.18863636363636366
4852,AirAsia,"Cannot login account setting, keep shows failed password even put correctly. How supposed track refund status? Its month since last refund report.",Negative,0.18333333333333326
5099,Airport + Flight Tracker Radar,"Useful but... Built takes external sites maps unusable buggy. Give us option external browser, I rerate.",Positive,0.06666666666666668
5103,Airport + Flight Tracker Radar,I can't see early next day Here I Bangkok airport 23:00 flight 00.15 next day I can't see midnight. How useless that!!!!,Negative,0.125
5123,Airport + Flight Tracker Radar,Doesn't international airports. When searching region I find local airport instead smaller regional airports found. Can't really it.,Positive,0.175
5124,Airport + Flight Tracker Radar,Flight Tracker What waste time. This us worth downloading. Does nothing. Thinknit developers thst rated I fail see pointb is!,Negative,0.1333333333333333
5140,Airway Ex - Intubate. Anesthetize. Train.,In tutorial won't let move left I cant get past tutorial,Negative,0.125
5204,Akinator,This amazing...it guessed every characters I thought...loved much... I defeated 2 times anyone else wants defeat ask questions book characters like novels...,Positive,0.15000000000000002
5241,AlReader -any text book reader,Add support pdfs ability move back forward sentences using remote tts get 5 stars.,Negative,0.1
5251,AlReader -any text book reader,Very useful reading formats supported,Positive,0.0
5359,Alfred Home Security Camera,I paid premium I multiple viewers still allows 1 time. In fact benefit paying storage. This fixed.,Positive,0.1
5406,"AliExpress - Smarter Shopping, Better Living","How come look Adult items even 21 years old? This seems irregular, tells ""local laws"" kids 16+ buy items. Please fix this.",Positive,0.16666666666666666
5568,All Events in City,Very useful in my mobile culinary work (move2) from one place to another. For that I need event info in each nearby city,Positive,0.0
5601,All Football - Latest News & Videos,Interest app..... Very useful go.,Positive,0.0
5628,"All Football GO- Live Score, Games",Very useful.. I like,Positive,0.0
5630,"All Football GO- Live Score, Games",Missing matches last 5 games area,Negative,0.05833333333333333
5716,All Maths Formulas,Very useful,Positive,0.0
5741,All Mental disorders,"Very useful pinch. Not specifically DSM, includes DSM criteria presented descriptive applicable way.",Positive,0.0
5781,All Mental disorders,"Very useful pinch. Not specifically DSM, includes DSM criteria presented descriptive applicable way.",Positive,0.0
5846,All Social Networks,Waste guys loading long time wait time net pls don't install guys,Negative,0.13333333333333333
5924,"All-In-One Toolbox: Cleaner, Booster, App Manager",Well Done App. Appreciated USMC VETERAN RETIRED,Positive,0.05
6082,Allrecipes Dinner Spinner,"Gave hard time downloading (took forever) wont let sign google Facebook. I tried ""create account""....it gave ""problem creating account"" message. I'm uninstalling since doesnt work get blank white screen",Negative,0.18055555555555555
6340,"Amazon FreeTime – Kids’ Videos, Books, & TV shows","I think fun play,watch relax eat popcorn family sitting back couch",Positive,0.1
6464,Amazon Kindle,It useful improves English vocabulary,Positive,0.0
6478,Amazon Kindle,I find useful need kill time waiting others.,Positive,0.0
6488,Amazon Kindle,This useful needs urgent information particular knowledge.,Positive,0.16666666666666666
6699,Amazon Shopping,"It's worth wait get want. And lower price amazon ,than stores",Positive,0.1
6736,Amazon for Tablets,"What waste time. You update (at last) bother include Australian store. You've included Australia phone app, tablet? Update: Another update still Australian store. Update 2: Still Australian store! Update 3: Still Australian store. Update 4: Still Australian store. Update 5: Still Australian store. Update 6: Still Australian store. Update 7: Still Australian store! Update 8: Still Australian store! Update 9: Still Australian store. Update 10: Still Australian store. Update 11: Still Australian store. Pathetic!",Negative,0.07111111111111111
6879,Amex Mobile,Amex offers stopped working. hangs.,Positive,0.0
6960,Amtrak,This missing ability put train number see stations stops,Negative,0.05
6963,Amtrak,"Unlike mobile website, completely useless, barely usable.",Negative,0.15000000000000002
6980,Anatomy Learning - 3D Atlas,"I'm visual person helped lot. Bones flat, like screen hand outs, helped see bones dynamic way.",Negative,0.0972222222222222
7043,Ancestry,Totally worth service.,Positive,0.1
7060,AndroZip™ FREE File Manager,Really useful app. Will update review I face issues.. Here comes first review. Facing renaming issues. Getting rename error folders.,Positive,0.16666666666666666
7064,AndroZip™ FREE File Manager,Bugs crated fixed Last update keeps crashing. Can't unzip anything. Used 4-5 stars fails purpose,Negative,0.18888888888888888
7073,AndroZip™ FREE File Manager,Doesn't work all. Does give access anything file system. Screen blank except buttons left right advert bottom. None buttons work. Complete waste time!!!,Negative,0.18714285714285714
7076,AndroZip™ FREE File Manager,Useful hard eyes Pls need make next update screen black white easier eyes pls,Negative,0.195
7083,AndroZip™ FREE File Manager,I created zip file using app. But I cant extract anymore. Unzipping fails everytime. Never happened I updated last version I used 2013. Now unusable. I regret updating now.,Negative,0.18333333333333326
7511,Angry Birds Classic,Nothing ad riddled garbage. Used fun pay-to-play waste time obscene number ads. No thanks!,Negative,0.13333333333333333
7651,Angry Birds Classic,Nothing ad riddled garbage. Used fun pay-to-play waste time obscene number ads. No thanks!,Negative,0.13333333333333333
7707,Angry Birds Rio,"The adds waste time, I've never downloaded adds I never will.",Negative,0.0
8369,"Apartment List: Housing, Apt, and Property Rentals",I want prices. Nothing price. Waste time!,Negative,0.0
8449,"Apartment, Home Rental Search: Realtor.com Rentals",Not Canada. Maybe u guys state front waste time garbage.,Negative,0.0
8544,Apartments.com Rental Search,The last update made font white black backdrop within apartment information page. Please fix this!!!,Negative,0.16666666666666666
8553,Apartments.com Rental Search,Very useful.,Positive,0.0
8584,Apartments.com Rental Search,The last update made font white black backdrop within apartment information page. Please fix this!!!,Negative,0.16666666666666666
8593,Apartments.com Rental Search,Very useful.,Positive,0.0
8620,Apex Launcher,"The post 4.0 update solves issues, still odd icon size limitations home page, I can't reorder change default screen. There's still work done get back were...",Negative,0.125
8624,Apex Launcher,Version 4.0.1 (the updated update) big improvement. Apex back way I like it. The customer support first-rate. They responded quickly problems last version,Positive,0.16666666666666666
8650,Apex Launcher,"Upgd fm v3 - v4 cost 'em 2 *'s -missing features, buggy, like beta release, u/g 'til fixed",Negative,0.125
8661,Apex Launcher,"The post 4.0 update solves issues, still odd icon size limitations home page, I can't reorder change default screen. There's still work done get back were...",Negative,0.125
8665,Apex Launcher,Version 4.0.1 (the updated update) big improvement. Apex back way I like it. The customer support first-rate. They responded quickly problems last version,Positive,0.16666666666666666
8724,Apk Installer,Useless It useful qualities hence waste time,Negative,0.06666666666666668
8737,App vault,"I'm using Mi 5S I found useful me, want turn off, always go ""setting > home screen & recents"" , turn Vault off.",Positive,0.0
8925,Apple Daily 蘋果動新聞,"So annoying! Every time go back is the first news back to the previous board. If you want to drop the dd news, you have to roll down several times each time. Can I go back to the last news unit?",Negative,0.19506172839506172
9138,Arrow.io,Minus mb,Negative,0.1
9165,Asana: organize team projects,It's mess.,Negative,0.175
9173,Asana: organize team projects,"Definitely best task manager there. Have used bunch works best makes sense. One big thing missing ability see tasks organisations/workspaces, screen.",Positive,0.1875
9205,Asana: organize team projects,It's mess.,Negative,0.175
9510,AutoCAD - DWG Viewer & Editor,Very useful,Positive,0.0
9545,AutoScout24 Switzerland – Find your new car,Very useful,Positive,0.0
9694,Avakin Life - 3D virtual world,I really like app. But there's thing I'm concerned with. There lots perverts app. Gross,Positive,0.1
9749,Aviary Effects: Classic,Waste downloading First version awsme... n giv 5 stars thousand times.... der nothing ... downloadin' classic effects ... luv classic effects... gives diffrnt luk picx...plz something... den giv yu 5 stars sure...plz something....,Positive,0.16666666666666666
9765,Aviary Effects: Classic,Question Why showing effects Aviary still I installed Classic! Work I update rating!,Positive,0.16666666666666666
9842,Azar,It's waste ....third grade,Negative,0.0
9857,Azar,Waste time......paid girls,Negative,0.0
9873,Azar,waste time.,Negative,0.0
9886,Azar,It worth apps.. Sometimes work itself...,Positive,0.1
10038,BBC Media Player,"Pissed. Downloaded watch clip cause forced even work. Won't buffer, kee0s saying try later never loads. Please fix.",Negative,0.1
10042,BBC Media Player,"Have greeted ""This content seem working. Please try later."" long time, can't even remember last time worked. Is point app?",Negative,0.15555555555555556
10094,BBC News,long time news centered cell phone half paragraph end paragraph effectively missing please fix order give five-star I S8 Plus centered I'm missing letters,Negative,0.16666666666666669
10097,BBC News,I appreciate lack commercials. It remembers I really well I article go back.,Positive,0.1
10125,BBC News,"Half stories load & developers seem give damn. If want news BBC, go website, waste time.",Negative,0.08333333333333333
10134,BBC News,long time news centered cell phone half paragraph end paragraph effectively missing please fix order give five-star I S8 Plus centered I'm missing letters,Negative,0.16666666666666669
10174,BBC News,long time news centered cell phone half paragraph end paragraph effectively missing please fix order give five-star I S8 Plus centered I'm missing letters,Negative,0.16666666666666669
10303,BBM - Free Calls & Messages,"Best messaging App, esp. For security. But, less desirable since BlackBerry turned management second party.",Positive,0.12222222222222222
10326,BBVA Compass Banking,"You scroll back month month, year year order enter birthday sign up....feeling old reset twice. No reason can't enter it.",Positive,0.1
10361,BBVA Spain,Very useful to manage the savings contracted products,Positive,0.0
10464,BBW Dating & Plus Size Chat,DO NOT USE THIS It's trash. I cancelled told I go Google get money back. Now Google going back them. They sent broken link I'm paying trash I use. Don't let get you. I'm getting lawyer.,Negative,0.13333333333333333
10480,BBW Dating & Plus Size Chat,Well first time ask later,Positive,0.16666666666666666
10483,BBW Dating & Plus Size Chat,It wants money messages,Positive,0.1
10504,BBW Dating & Plus Size Chat,DO NOT USE THIS It's trash. I cancelled told I go Google get money back. Now Google going back them. They sent broken link I'm paying trash I use. Don't let get you. I'm getting lawyer.,Negative,0.13333333333333333
10520,BBW Dating & Plus Size Chat,Well first time ask later,Positive,0.16666666666666666
10523,BBW Dating & Plus Size Chat,It wants money messages,Positive,0.1
10544,BBW Dating & Plus Size Chat,DO NOT USE THIS It's trash. I cancelled told I go Google get money back. Now Google going back them. They sent broken link I'm paying trash I use. Don't let get you. I'm getting lawyer.,Negative,0.13333333333333333
10560,BBW Dating & Plus Size Chat,Well first time ask later,Positive,0.16666666666666666
10563,BBW Dating & Plus Size Chat,It wants money messages,Positive,0.1
10613,BBWCupid - BBW Dating App,Please like every site. No wants mert chat collect pictures. Might well us Craigslist,Negative,0.1
10631,BELONG Beating Cancer Together,Learned much app. Has useful,Positive,0.1
10638,BELONG Beating Cancer Together,It useful,Positive,0.0
10854,BEYBLADE BURST app,Fun kids however wont load world tournament challenges. The installed multiple times customer support contact reply.,Positive,0.1
10888,BIG Launcher,"I bought Big Launcher July 19, 2017, Its useful I encountered problem I can't find contacts Big Launcher Contact search sometime, I check default contacts sometimes sometimes though sometime contact comes back, launcher messing contacts I need solution. Please Help",Positive,0.05
10897,BIG Launcher,Still weather app. No reason not. It's limited functional otherwise.,Negative,0.14285714285714285
11011,BaBe - Baca Berita,"Useful, news recommendation repetitive news. Need improved.",Positive,0.125
11242,Babbel – Learn Spanish,Not useful way learn language,Negative,0.0
11247,Babbel – Learn Spanish,I learning Spanish ease fun.,Positive,0.1
11252,Babbel – Learn Spanish,It makes learning Spanish fun!,Positive,0.1
11290,Baby ABC in box! Kids alphabet games for toddlers!,It w wants buy level time gets aggravating,Positive,0.1
11337,Baby Monitor,"Works! This exactly supposed to. You put phone number, noise level goes set to, calls texts number depending specified. We've used several times traveling. One suggestion I would make update whatsapp type wifi supported program contact phone countries phone may work in.",Positive,0.125
11357,Baby Name Together,Very useful,Positive,0.0
11372,Baby Name Together,"Missing names like; Chase, Kylie, Mckenzie, Kinley, Skyler, Isabella, Sierra, etc...",Negative,0.05
11730,"Baca- Berita Terbaru, Informasi, Gosip dan Politik",Very Useful,Positive,0.0
11840,BaconReader for Reddit,"Reddit video links load excruciatingly slowly, half time load all, there's way hear audio videos.",Negative,0.16666666666666666
11853,BaconReader for Reddit,It's Reddit stop shop. The widgets become part daily. Thanks Bacon reader!,Positive,0.1
11979,Badoo - Free Chat & Dating App,"Useless app, I recommend , waste time .",Negative,0.1
11997,Badoo - Free Chat & Dating App,Incredibly useful tool,Positive,0.0
12021,Badoo - Free Chat & Dating App,"Useless app, I recommend , waste time .",Negative,0.1
12039,Badoo - Free Chat & Dating App,Incredibly useful tool,Positive,0.0
12061,Badoo - Free Chat & Dating App,"Useless app, I recommend , waste time .",Negative,0.1
12079,Badoo - Free Chat & Dating App,Incredibly useful tool,Positive,0.0
12108,Bagan - Myanmar Keyboard,Very useful,Positive,0.0
12139,Banco Itaú,"In the middle of 2018 and Itaú still does not offer access option via biometrics. Simply embarrassing. And then it looks like a propaganda stick saying it's a modern, digital bank.",Positive,0.1514285714285714
12195,Banco do Brasil,Adaptive icon missing,Negative,0.05
12201,Banco do Brasil,Very useful,Positive,0.0
12220,Bancomer móvil,"Mandatory facial recognition weighs on the experience of the application. Before it was useful simple to use now even if you take the photo, always says there was an error.",Positive,0.11904761904761905
12224,Bancomer móvil,It was very. Well before the last update. Please reverse the change of the facial imprint. I always get the server error now I can access my bank.,Positive,0.12222222222222222
