,App,Translated_Review,Sentiment,Sentiment_Subjectivity
12225,Bancomer móvil,"The previous version worked well, in this when trying to enter any credit card comes the following error. Java.lang.IndexOutOfBoundsException (Index: 1, Size: 1)",Negative,0.13333333333333333
12227,Bancomer móvil,"I have been unable to register my facial print for 5 days, INTERNAL ERROR DURING THE PROCESS, what do I do? I uninstall it?",Negative,0.16666666666666666
12238,Bancomer móvil,"Regrettable that oblige the user to add the facial fingerprint, even if one agrees to register the facial fingerprint the application fails at the time of finalizing the registration.",Negative,0.1
12265,Banfield Pet Health Tracker,"""View Medical History"" Status Center work. I uninstalled installed. I force closed app. I restarted phone. Please fix bug I give 5 stars!",Negative,0.06666666666666668
12305,Banfield Pet Health Tracker,"""View Medical History"" Status Center work. I uninstalled installed. I force closed app. I restarted phone. Please fix bug I give 5 stars!",Negative,0.06666666666666668
12345,Bangla Newspaper – Prothom Alo,It useful me...... So I give u 5*,Positive,0.0
12363,Bangla Newspaper – Prothom Alo,"Most inconsistent ever terms development. Sometimes goes forward update, sometimes goes backwards. After last update, I can't log comments. After putting credentials starts redirecting continues infinity. It's shame representing No. 1 daily country.",Positive,0.18888888888888888
12387,Banjo,"Doesn't work anymore Installed, says I need login social Network. The listed Instagram, I account.",Positive,0.06666666666666668
12455,BankMobile Vibe App,Your missing using app.,Negative,0.05
12492,Banorte Movil,"With its last update of the red icon it scans the qr codes for Transfer, the section of my qr code does not appear either. I hope it works again since it is very useful",Positive,0.022222222222222227
12511,Banorte Movil,Improve facial recognition A825 - Allow frequent reliable operations; Periodic operations and income every time the same data; Separate by type of operation. Greetings P. Colonel,Positive,0.14166666666666666
12529,Banque Populaire,A historical section of the samples received is missing,Negative,0.025
12728,Barclays US for Android,"Fingerprint sensor login work second time I set up, render useless.",Negative,0.1
12984,Basketball Stars,Every time I play match cash wasted I playing match comes notice Internet moment I return back match opponent even I started playing match . Sometimes opponent trying basket I block game's controls get blocked opponent wins match,Negative,0.15000000000000002
13030,Bathroom Decorating Ideas,Junk Not useful,Negative,0.0
13032,Bathroom Decorating Ideas,Decorating Ideas Useful affordable ideas.,Positive,0.0
13045,Bathroom Decorating Ideas,Waste time,Negative,0.0
13155,Battlelands Royale,First thing I trying send request sister I never received tried never worked. Second I wish thier squad 50v50 please fix add I would give five stars thank,Positive,0.16666666666666666
13232,Be A Legend: Soccer,Buffer... Why I wain 10 minutes go another screen? There's point playing keeps happening. Just waste time.,Negative,0.0
13288,BeSoccer - Soccer Live Score,It's useful,Positive,0.0
13327,BeWild Free Dating & Chat App,Garbage. S#!try even let register. Kept telling enter 5 digit zip code... I know damn zip code. Don't waste time believe anything star.,Negative,0.0
13334,BeWild Free Dating & Chat App,I cant even get past setup. Its asking put valid email i've done multiple times still repeats screen try submit. It keeps repeating put valid email over. Please help,Negative,0.125
13377,Beautiful Design Birthday Cake,Not worth to..,Negative,0.1
14310,Best Wallpapers QHD,This sucks qhd wallpapers peace garbage waste time,Negative,0.15
14379,"BestCam Selfie-selfie, beauty camera, photo editor",Time wasted,Negative,0.0
14402,"BestCam Selfie-selfie, beauty camera, photo editor",Waste,Negative,0.0
14527,BeyondMenu Food Delivery,"I've used issues order coupons restaurant honor glitch I removed app. Six months later I figured give another try damn thing happens order. No word yet restaurant honor coupon time. Removing again! Tip, call order less confusion.",Negative,0.03333333333333333
14535,BeyondMenu Food Delivery,"I using grubhub FOREVER killer Asian food. Sushi, chinese, etc... cheaper better. Go",Positive,0.16666666666666666
14636,Bible,Read daily. Best Bible I've used. Thank,Positive,0.15
14730,Big Days - Events Countdown,"Simple and useful, limited number of events",Positive,0.16666666666666666
14986,BioLife Plasma Services,Half time doesnt show appointments (i see login computer site). Also coupon code field doesnt work. Tried twice now. Galaxy s8,Negative,0.16666666666666666
15002,Birdays – Birthday reminder,"First 5-stars, 3-stars rating. After switching times zones, EVERY date +1. Forced close, cleared cache, imported contacts second time. Nothing helps. Reinstallation helped. Hope fix soon, 'cause VERY useful!",Positive,0.13333333333333333
15080,Black People Meet Singles Date,This sucks. They 30 people app. The features dont work cant choose age range range mile radius. Don't waste time money.,Negative,0.15
16127,Blogaway for Android (Blogger),My post keep failing. I saved something draft. So I keep trying upload work working I tried uninstall reinstall whala. My draft saved deleted. Deleted. Deleted. Tsk Tsk Tsk Tsk. Update: today 10-26-2017 I still cannot upload / publish article. Fix please. It keeps showing ads longer worth phone letting publish article. Can somebody fix issue?,Positive,0.1
16149,Blogaway for Android (Blogger),This deleted drafts. I spent days writing they're gone.,Negative,0.1
16162,Blogaway for Android (Blogger),"The working absolutely fine last update v7.0.3 feature ""My Signature"" working. Please fix issue next update",Positive,0.18888888888888888
16268,Blood Donor,Very useful app!,Positive,0.0
16276,Blood Donor,"In last update, someone decided good idea remove bar code donor card. This code used check center, nurses get donor information. Put barvode back please.",Positive,0.19166666666666668
16301,Blood Pressure,Waste application! Never,Negative,0.0
16307,Blood Pressure,Do app.. waste time...,Negative,0.0
16316,Blood Pressure,"The covers basic vitals, missing temperature. Please add temperature, could manage. Thank",Negative,0.0875
16367,Blood Pressure(BP) Diary,Wants access contacts lists! Way intrusive!,Positive,0.1
16397,Blood Pressure(BP) Diary,Well thanks bunch. Forced update year results lost. Won't even let import last backup. If ain't broke fix it.........,Negative,0.15555555555555556
16407,Bloomberg Professional,"buggy, lot slower less intuitive compared iOS version.",Negative,0.06666666666666668
16413,Bloomberg Professional,Much much slower prior versions,Positive,0.1
16456,Bloomberg: Market & Financial News,I can not login. The application is closed when I enter an email.,Negative,0.1
16464,Bloomberg: Market & Financial News,The previous bloomberg radio+ much better..this slow clunky listening audio. Bring back Bloomberg Radio!,Negative,0.19166666666666665
16467,Bloomberg: Market & Financial News,When I notification go correct story. It usually goes story back. The several times.,Negative,0.08333333333333333
16759,Blur Image Background Editor (Blur Photo Editor),It useful,Positive,0.0
16774,Booking.com Travel Deals,"The offers book pay later fraud, pay later hotel realise total amount shown excluding taxes Then hotel time check end paying much online sites offering",Positive,0.19
16806,Booking.com Travel Deals,"Month I communicate with the booking with the request to return the money for the reservation. Politely for the first time answered that we will return everything, the second time we asked to fill out the form and attach an extract from the bank. Today for the third time I called them, I send again the supporting documents. A month passed since the contact with the book. 2 months from cancellation ... no money ..",Positive,0.14583333333333331
16814,Booking.com Travel Deals,"The offers book pay later fraud, pay later hotel realise total amount shown excluding taxes Then hotel time check end paying much online sites offering",Positive,0.19
16846,Booking.com Travel Deals,"Month I communicate with the booking with the request to return the money for the reservation. Politely for the first time answered that we will return everything, the second time we asked to fill out the form and attach an extract from the bank. Today for the third time I called them, I send again the supporting documents. A month passed since the contact with the book. 2 months from cancellation ... no money ..",Positive,0.14583333333333331
16854,Booking.com Travel Deals,"The offers book pay later fraud, pay later hotel realise total amount shown excluding taxes Then hotel time check end paying much online sites offering",Positive,0.19
17217,Box,How remove 2 step verification number permanently closed,Negative,0.1
17257,Box,How remove 2 step verification number permanently closed,Negative,0.1
17297,Box,How remove 2 step verification number permanently closed,Negative,0.1
17390,Boys Photo Editor - Six Pack & Men's Suit,Waste,Negative,0.0
17483,Branch,My first experience regards loan sought satisfactory .And I look forward getting know financial transactions provided .,Positive,0.16666666666666666
17525,Brasileirão Pro 2018 - Série A e B,Very useful,Positive,0.0
17892,British Airways,"Convenient boarding passes information. However, baggage allowance correctly displayed, leading confusion time waste. Please fix this.",Negative,0.0
17894,British Airways,logs recognise log details. Now less useless.,Negative,0.13333333333333333
17897,British Airways,"Best airline app! Aesthetically pleasing, useful, practical. Why can't like one?",Positive,0.15
17979,Bualuang mBanking,I see details transactions last 3 days. The call center cannot either. I suspend card 5 days I get details suspicious transaction.,Negative,0.08333333333333334
18005,Bualuang mBanking,The error updated 31 May 2018 unavailable contact call center 1333 02-645-5555,Negative,0.1
18013,Bubble Shooter,"Solid, repetitive.",Negative,0.175
18629,Bukalapak - Jual Beli Online,"bought product. seller send. JNT delivered me. strangely, bukalapak CS respond anything. unresponsive professional",Positive,0.125
18641,Bukalapak - Jual Beli Online,"Inbox in Bukalapak likes Error, notification inbox has to wait for a few hours to appear, even it never appears at all",Negative,0.1
18645,Bukalapak - Jual Beli Online,"from the cellphone shake event if you go to the main menu of purchase, how come back to the event to shake the cellphone ...? do you want to see the product if every time the main purchase purchases the vibrational tone goes back to the cell phone shake event (like loop trs)? ... seems like a bug, boss ... I use redminote 4 ...",Positive,0.16666666666666666
18816,Business Calendar 2,"I wanted calendar independent GOOGLE! This automatically synced Google calendar phone, course, goes ""madatoey, forced sign-ups Gmail"", exactly I DO NOT WANT!! I cannot find way change put email preference! WTHeck!?!?!",Negative,0.19166666666666665
19019,"BÁO MỚI - Đọc Báo, Tin Tức 24h",Comments are closed. Flat,Negative,0.1125
19027,"BÁO MỚI - Đọc Báo, Tin Tức 24h","Duplicate news vs contrary lot. Improve the comment function ""Send a message to the commentator when BLM is approved vs. when another reader interacts with the previous comment""",Negative,0.16666666666666666
19038,"BÁO MỚI - Đọc Báo, Tin Tức 24h",Take off the clip few children show off. Allows the viewer to be customized to remove some political items.,Negative,0.1
19043,"BÁO MỚI - Đọc Báo, Tin Tức 24h",Offer less censorship!,Negative,0.06666666666666668
19093,C++ Programming,"Not best ,several errors Bro I give advice install error like header file missing",Negative,0.11666666666666665
19149,C++ Tutorials,"Thank you!!! I'm student university guilan.this useful me.I'm second term I lesson called ""programing c++"".and helps much.",Positive,0.06666666666666668
19174,CAIXA,"After a few weeks without using app, I tried to log into my account using digital, but said password was incorrect. I tried again, until I blocked my user. I created another user, and when I went to try to log in again it appeared that there was no user. I did the same thing again ... Full Review",Positive,0.19375
19882,CDL Practice Test 2018 Edition,A lot exact questions actual test. Blew mind.,Positive,0.175
19887,CDL Practice Test 2018 Edition,Very informative helpful useful planning take CDL,Positive,0.15
19891,CDL Practice Test 2018 Edition,Helps much remembering info previously know .A++++,Positive,0.18333333333333332
20065,"CM Flashlight (Compass, SOS)",Simple useful,Positive,0.17857142857142858
20185,CM Locker - Security Lockscreen,Does Not meet expectation waste,Negative,0.0
20307,CNBC: Breaking Business News & Live Market Data,Usually find specific information quickly. Useful avoid sifting mountains data.,Positive,0.125
20315,CNBC: Breaking Business News & Live Market Data,"Best financial news app, alerts stock quotes money. Best financial app.",Positive,0.15
20346,CNN Breaking US & World News,Was going give another try. I arbitration clauses. Any company wants give fundamental rights make dime me.,Positive,0.1
20386,CNN Breaking US & World News,Was going give another try. I arbitration clauses. Any company wants give fundamental rights make dime me.,Positive,0.1
20426,CNN Breaking US & World News,Was going give another try. I arbitration clauses. Any company wants give fundamental rights make dime me.,Positive,0.1
20487,CVS Caremark,Why blue? Makes harder find people associate CVS red logo… Ever heard corporate brand identity?,Negative,0.025
20530,CW Seed,"It let resume I season, tried episode I said failed I restart it. So multiple times still work uninstalled it.",Negative,0.15
20537,CW Seed,The videos stopped working together. Choppy pixelated mess,Negative,0.1875
20562,CW Seed,Less commercials,Negative,0.06666666666666668
21459,"Calm - Meditate, Sleep, Relax",Waste time can't anything unless u pay £35/$ year =-(,Negative,0.0
21491,"Calm - Meditate, Sleep, Relax","With recent update, removed ability play sound background indefinitely. This upsetting I sleep night. I hope time future bring back feature. As I might find replacement.",Positive,0.19375
21505,"Calm - Meditate, Sleep, Relax",Waste time can't anything unless u pay £35/$ year =-(,Negative,0.0
21587,Calorie Counter & Diet Tracker,"Tried enter goal settings, got error saying connected. Also allow anything metric units despite changing settings. Waste time. Uninstalled.",Negative,0.0
21682,Calorie Counter - EasyFit free,"Very useful! I like fact add food math everything! Your macros, grams, % protein, calories fat! My fiance I using it.",Positive,0.0
21794,Calorie Counter - Macros,GARBAGE dont waste time. It refuses work tried multiple times.,Negative,0.0
21894,Calorie Counter - Macros,GARBAGE dont waste time. It refuses work tried multiple times.,Negative,0.0
21899,Calorie Counter - MyFitnessPal,"There's ""low carb"" option, lack ""net carbs"" showstopper. When looking documentation, appears 67 pages people requesting ability record net carbs. All responses state they'll look future. This seems like classic case company listening users.",Positive,0.11833333333333332
21910,Calorie Counter - MyFitnessPal,"Been using mfp long time. Presently 200 days row. Evidence shows I log I eating I keep control things body. When I stop logging, skinny jeans go back closet.",Negative,0.13333333333333333
21939,Calorie Counter - MyFitnessPal,"There's ""low carb"" option, lack ""net carbs"" showstopper. When looking documentation, appears 67 pages people requesting ability record net carbs. All responses state they'll look future. This seems like classic case company listening users.",Positive,0.11833333333333332
21951,Calorie Counter - MyFitnessPal,"Been using mfp long time. Presently 200 days row. Evidence shows I log I eating I keep control things body. When I stop logging, skinny jeans go back closet.",Negative,0.13333333333333333
21979,Calorie Counter - MyFitnessPal,"There's ""low carb"" option, lack ""net carbs"" showstopper. When looking documentation, appears 67 pages people requesting ability record net carbs. All responses state they'll look future. This seems like classic case company listening users.",Positive,0.11833333333333332
21991,Calorie Counter - MyFitnessPal,"Been using mfp long time. Presently 200 days row. Evidence shows I log I eating I keep control things body. When I stop logging, skinny jeans go back closet.",Negative,0.13333333333333333
22019,Calorie Counter - MyFitnessPal,"There's ""low carb"" option, lack ""net carbs"" showstopper. When looking documentation, appears 67 pages people requesting ability record net carbs. All responses state they'll look future. This seems like classic case company listening users.",Positive,0.11833333333333332
22031,Calorie Counter - MyFitnessPal,"Been using mfp long time. Presently 200 days row. Evidence shows I log I eating I keep control things body. When I stop logging, skinny jeans go back closet.",Negative,0.13333333333333333
22080,Calorie Counter - MyFitnessPal,"Needs keto option, without net carbs really screws macros.",Positive,0.1
22119,Calorie Counter - MyFitnessPal,"There's ""low carb"" option, lack ""net carbs"" showstopper. When looking documentation, appears 67 pages people requesting ability record net carbs. All responses state they'll look future. This seems like classic case company listening users.",Positive,0.11833333333333332
22131,Calorie Counter - MyFitnessPal,"Been using mfp long time. Presently 200 days row. Evidence shows I log I eating I keep control things body. When I stop logging, skinny jeans go back closet.",Negative,0.13333333333333333
22192,Calorie Counter - MyNetDiary,"I love My net diary, incredibly useful tool weightloss tracking actual daily activity!!!",Positive,0.14
22193,Calorie Counter - MyNetDiary,Half foods show unless junk food,Negative,0.16666666666666666
22292,Calorie Counter - MyNetDiary,"I love My net diary, incredibly useful tool weightloss tracking actual daily activity!!!",Positive,0.14
22293,Calorie Counter - MyNetDiary,Half foods show unless junk food,Negative,0.16666666666666666
23111,Cameringo Lite. Filters Camera,Useful !!!!❤,Positive,0.0
23646,Candy Crush Soda Saga,"I playing game last night realizing phone reason date changed October 5, 2018..so I ran lives I quit... Well I went play says I something like 1806 hours next life.. That October 5, 2018..how I Fix this??",Negative,0.15555555555555556
23673,Candy Crush Soda Saga,"Hello, í signing daily basis long time. Today I sign in, daily bonuses gone. I day 2000. It bought back day one. I missed day. Please fix.",Negative,0.1
23686,Candy Crush Soda Saga,"I playing game last night realizing phone reason date changed October 5, 2018..so I ran lives I quit... Well I went play says I something like 1806 hours next life.. That October 5, 2018..how I Fix this??",Negative,0.15555555555555556
23713,Candy Crush Soda Saga,"Hello, í signing daily basis long time. Today I sign in, daily bonuses gone. I day 2000. It bought back day one. I missed day. Please fix.",Negative,0.1
23726,Candy Crush Soda Saga,"I playing game last night realizing phone reason date changed October 5, 2018..so I ran lives I quit... Well I went play says I something like 1806 hours next life.. That October 5, 2018..how I Fix this??",Negative,0.15555555555555556
23754,Candy Crush Soda Saga,"Hello, í signing daily basis long time. Today I sign in, daily bonuses gone. I day 2000. It bought back day one. I missed day. Please fix.",Negative,0.1
23763,Candy Crush Soda Saga,Dropping rating 5 stars 2. Whenever I gold bars continue level game freezes takes bars. I lost 27 gold bars now. Give bars back I'll give back 5 star rating.,Negative,0.13333333333333333
23770,Candy Crush Soda Saga,"This review, minor issue... keeps starting levels I already completed. I tried reinstall, still thing.???",Negative,0.15000000000000002
23914,Candy Smash,It's fun big challenge though,Positive,0.15000000000000002
24005,"Canva: Poster, banner, card maker & graphic design",Useful. But seems incorrect line spacing exporting file.,Positive,0.0
24967,Chakra Cleansing,Use meditation relaxing. I find useful recommend anyone looking biosound therapy,Positive,0.0
24991,Championat,"For half a year I can not log into my account from the application - ""try again after 70 seconds""",Negative,0.16666666666666666
25044,Chapters: Interactive Stories,I bought 60 gems $5 disappeared without using them. Don't waste money,Negative,0.0
25100,"Chat Rooms, Avatars, Date - Galaxy",My character got lost code I enter says incorrect recovery code I spent lot money develop levels.. Everything lost,Negative,0.1
25109,"Chat Rooms, Avatars, Date - Galaxy",Useful,Positive,0.0
25140,"Chat Rooms, Avatars, Date - Galaxy",My character got lost code I enter says incorrect recovery code I spent lot money develop levels.. Everything lost,Negative,0.1
25149,"Chat Rooms, Avatars, Date - Galaxy",Useful,Positive,0.0
25180,ChatVideo Meet new people,Third class nd time waste .,Negative,0.0
25248,Cheap Flights & Hotels momondo,It's useful,Positive,0.0
25304,"CheapTickets – Hotels, Flights & Travel Deals",No apparent way import itinerary ticket purchased 3rd party.,Negative,0.175
25377,Cheapflights – Flight Search,useful app. give 5 stars add sri lankan rupee to.,Positive,0.0
26583,Cisco Webex Teams,"Previous versions message previews, allowing see last message space.",Negative,0.11666666666666667
26595,Cisco Webex Teams,It useful,Positive,0.0
26667,Citibanamex Movil,"In my case after the update stopped working, the screen remains blank, and uninstall and install anything, help me if it is very useful Thank you and I am resolved!",Positive,0.0
26700,Citizens Bank Mobile Banking,"This garbage. I've wasted much time trying mobile deposit worth. Followed line help, verified pictures clear, verified accounts linked. Will always say feature available time, try back later. Garbage.",Positive,0.1547619047619048
26718,Citizens Bank Mobile Banking,"I downloaded manage auto loan. While remaining balance displays app, utterly useless terms payment. You cannot add accounts payment, even appears way make payment app. The mobile considerably useful.",Negative,0.1
26775,CityMaps2Go Plan Trips Travel Guide Offline Maps,Was really useful I visiting DC!,Positive,0.0
26782,Claro,"Waste of App, waste your time",Negative,0.0
26799,Claro,What a mess of application,Negative,0.175
26814,Claro,"I did not ask for it, I use it, but Claro allows you to remove it. A waste a disrepect to the client.",Negative,0.0
27862,Color Road,"Every time I tried swipe, work. Also, brothers colourblind played difficulty red green . Plz fix I'll give 4 stars",Negative,0.15
28217,ColorNote Notepad Notes,"Its useful app. The problem mistakenly deleted wrote, can't undo redo. I hope add feature",Positive,0.0
28260,ColorSnap® Visualizer,This sucks! Dont waste time.,Negative,0.15
28382,Colorfy: Coloring Book for Adults - Free,"GARBAGE. This wants pay every single color stuff, colors EXTREMELY basic cant choose color mixes.",Positive,0.14642857142857146
28420,Colorfy: Coloring Book for Adults - Free,"GARBAGE. This wants pay every single color stuff, colors EXTREMELY basic cant choose color mixes.",Positive,0.14642857142857146
28555,Coloring book moana,It missing filling,Negative,0.05
28584,Coloring book moana,It missing filling,Negative,0.05
28603,Comedy Central,"There south park episodes still best Randy can't watch episodes, says video unavailable please update put back 5*",Positive,0.15
28643,Comedy Central,"There south park episodes still best Randy can't watch episodes, says video unavailable please update put back 5*",Positive,0.15
28677,Common Core,"I like app, really good English math standards. The SS standards basically non existent. It lists reading writing goals subject upon looking details English math goals... even list SS science. I needed topics covered I'll keep English math standards. I'll need continue search SS science.",Positive,0.18666666666666668
28902,Comptia A+ 220-901 & 220-902,Very useful,Positive,0.0
28955,Contacts,The Link contacts button missing. I account Exchange Google. I several automatically one. I tried button simply there. I unlinked existing account see button would show individual contact pages. Now I can't link back! This gold standard point. I come back change 5.,Negative,0.1153061224489796
28987,Contacts+,Very useful,Positive,0.0
28998,Contacts+,Useful everyone every time,Positive,0.0
29009,Contacts+,"Cannot restore contacts although I backed hundreds. The number contacts showing back up, cannot restore them. I contacted support multiple times clue. Gave up. Also, I cannot edit contacts even I separate them. I lost many hours time trying everything solve problem. Now I excel file old contacts I search find people I want call",Positive,0.175
29037,Content Transfer,How anyone actually get work? I giving up. Useless!!!,Negative,0.15000000000000002
29056,Content Transfer,Disconnected multiple times. The directions need state needs installed phones. Other I'm satisfies,Negative,0.1875
29081,ConvertPad - Unit Converter,Using 1 minute arc earth = 6000 ft = 1 nautical mile best accuracy plotting position scaling object map sailing walking flying driving. This makes 1 second arc 100ft interfere statute miles kilometers engineering construction. Degrees Minutes (or Miles nautical) Seconds DMS. John.,Positive,0.15
29082,ConvertPad - Unit Converter,"Very useful app, I frequently, never problems, ask immediately...nothing more, nothing less. Wish same.",Positive,0.19833333333333333
29088,ConvertPad - Unit Converter,Use daily Cannot count times quite useful.,Positive,0.0
