,App,Translated_Review,Sentiment,Sentiment_Subjectivity
29174,Cooking Channel,Select provider screen blank. Typing box show results. Can't login useless app.,Negative,0.1
29395,Cookpad,Very useful mothers world,Positive,0.0
29434,Cool Popular Ringtones 2018 🔥,A useful could best songs using guitar would added,Positive,0.15
29488,Couch to 10K Running Trainer,"I started hating running, even stand initial minute week one. On week 9 I run 5k 30 mins 31 yrs old. Thank helping get energy back!",Positive,0.06666666666666668
29505,Couch to 10K Running Trainer,"Downloaded couch 10k, even paid upgrade, I see 13.1 training program there. I want train half marathon.",Negative,0.16666666666666666
29533,Couch to 5K by RunDouble,Crashed last run set 2 days row! No way get Stats run back start I was. So frustrated!,Negative,0.08888888888888889
29567,Couchsurfing Travel App,"1) This automatically takes language device instead independent language settings. So way English set device English well. 2) Keyword based search inaccurate. 3) On Search Result Pages people's profile photos displayed incorrectly, 4:2 ratio photos cut half. 4) Lacks many features website.",Positive,0.15833333333333333
29590,Couchsurfing Travel App,"useful learned people equal, real difference exists.İ feel closer world now.",Positive,0.18333333333333332
30547,Credit Sesame,I made payment 7 days daily refresh money deducted debit card updates available. I'm still receiving payment option renew plan I purchased. I've submitted multiple messages support feedback tab responded. Don't waste money.,Positive,0.1
30548,Credit Sesame,This waste time shows score details provide explanation got score.,Negative,0.0
30551,Credit Sesame,"Well, I interested seeing could let finish registering. It took user password I got I put ssn ""authorized"" get data, kept taking feedback screen I write review/give feedback. It give option close page, back button worked, nothing else... And would take back screen I ""authorize"" again. I tried 4 times uninstalled.",Positive,0.16666666666666666
30594,CreditWise from Capital One,CreditWise helped raise credit score 20 points 1 month. They explain detail personal situation steps follow success. I thankful app.,Positive,0.15
30899,Crunchyroll - Everything Anime,Yea... I pay premium membership phone ps4 work properly time. I weeks content missing updated episode list atm even open (phone app). Ps4 almost never wants fully load me. Please upgrade quality service.,Negative,0.1875
30939,Crunchyroll - Everything Anime,Yea... I pay premium membership phone ps4 work properly time. I weeks content missing updated episode list atm even open (phone app). Ps4 almost never wants fully load me. Please upgrade quality service.,Negative,0.1875
30979,Crunchyroll - Everything Anime,Yea... I pay premium membership phone ps4 work properly time. I weeks content missing updated episode list atm even open (phone app). Ps4 almost never wants fully load me. Please upgrade quality service.,Negative,0.1875
31060,Curriculum vitae App CV Builder Free Resume Maker,"It sucks, u can't save urine cv urban phone send sum1",Negative,0.15
31086,Curso de Ingles Gratis,I started 1st lesson I hope I speak English very well,Positive,0.15
31456,"Cymera Camera- Photo Editor, Filter,Collage,Layout",Very useful,Positive,0.0
31462,"Cymera Camera- Photo Editor, Filter,Collage,Layout",Very useful.,Positive,0.0
31496,"Cymera Camera- Photo Editor, Filter,Collage,Layout",Very useful,Positive,0.0
31502,"Cymera Camera- Photo Editor, Filter,Collage,Layout",Very useful.,Positive,0.0
31536,"Cymera Camera- Photo Editor, Filter,Collage,Layout",Very useful,Positive,0.0
31574,Czech Public Transport IDOS,Extremely useful using public transport Czech Republic. This I phone.,Positive,0.03333333333333333
31635,DC Super Hero Girls™,I downloaded hope worth,Positive,0.1
31675,DC Super Hero Girls™,I downloaded hope worth,Positive,0.1
31715,DC Super Hero Girls™,I downloaded hope worth,Positive,0.1
32096,DELISH KITCHEN - 無料レシピ動画で料理を楽しく・簡単に！,"thanks to the delishkitchen recipes, I can study Japanese cuisine, and is very helpful.",Positive,0.16666666666666666
32104,DELISH KITCHEN - 無料レシピ動画で料理を楽しく・簡単に！,So useful app! I wish could written English.,Positive,0.0
32111,DELISH KITCHEN - 無料レシピ動画で料理を楽しく・簡単に！,Useful,Positive,0.0
32158,DINO HUNTER: DEADLY SHORES,Had game months.. Purchased problem.. Was level 12. During last month purchased almost 100 dollars coins receive reset back level 1. So coins 100$ back level 1. Pissed off!!!!,Negative,0.11666666666666667
32268,DIY On A Budget,"Useless app, alot people sharing questions half baked ideas diy. No actual diy budget tips here.",Negative,0.15555555555555556
32380,DRAGON BALL LEGENDS,Garbage. The backup system trash. Spent loads hours building account lose I upgraded phone.,Negative,0.1
32420,DRAGON BALL LEGENDS,Garbage. The backup system trash. Spent loads hours building account lose I upgraded phone.,Negative,0.1
32460,DRAGON BALL LEGENDS,Garbage. The backup system trash. Spent loads hours building account lose I upgraded phone.,Negative,0.1
32547,DSLR Camera Hd Ultra Professional,Data waste,Negative,0.0
32548,DSLR Camera Hd Ultra Professional,Data waste,Negative,0.0
32616,DU Browser—Browse fast & fun,"What happened browser?! Used best......now, takes forever pages load half time render properly touchscreen becomes unresponsive. Sometimes freezes whole device. I problems 3rd party browser. Dev needs bug fixes next update instead worrying much decor.",Positive,0.14444444444444446
32627,DU Browser—Browse fast & fun,"Now I can't find music,video games browser...I can't say best ever...I hope can't update speed next time..keep",Positive,0.15
32637,DU Browser—Browse fast & fun,"T5 engine T5 engine helps lot video playback, guys change mind. Please, put back. Thanks alot.",Positive,0.1
33015,Daily Yoga - Yoga Fitness Plans,"I daily. It allowed develop daily fitness routine flexibility strength training, without increased chance injury. It still missing flexibility allow develop routines workout history. Having researched apps, I found nothing better. I since upgraded life member, I moving another app.",Positive,0.1375
33552,"Delivery Club–Доставка еды:пицца,суши,бургер,салат","In any modern application should be support for different languages. At least international - English. My wife does not speak Russian, so she can not use the services. In addition, authorization in the chat can be tied to the authorization of the application and the history stored locally.",Negative,0.1857142857142857
33594,Delta Dental,"Although site claims using version 4.5.1, Google Play offers version 3.0. Thus, cannot view claims due bug I reported year ago acknowledged having. So, limited application.",Negative,0.1726190476190476
33661,Despegar.com Hoteles y Vuelos,Very useful me.,Positive,0.0
33670,Detector de Radares Gratis,Useful,Positive,0.0
33701,Device Help,There chat option moto care executive. Now I solve phone problems? There available chat option. Without customer Executives chat option useful. The chat feature brought back.,Positive,0.13333333333333333
33717,Device Help,My Moto G3 front camera icon missing past 1 year... And diagnosed even showing option.,Negative,0.15
33748,Diabetes & Diet Tracker,"You track sugar alcohols, net carbs, diabetes carbs, that's I like best.",Positive,0.15
33788,Diabetes & Diet Tracker,"You track sugar alcohols, net carbs, diabetes carbs, that's I like best.",Positive,0.15
33917,Diary with lock,I using several months I really like design. want express feelings get want anyone looking private life want hide diary,Positive,0.19166666666666665
33956,Diary with lock,I using several months I really like design. want express feelings get want anyone looking private life want hide diary,Positive,0.19166666666666665
34062,Diary with lock password,old version already useless cant transfer data old phone old version doesnt work new version. dropbox back restore useless. cant transfer data old version.better bring back back external memory option.,Negative,0.15950413223140494
34072,Diary with lock password,I lost previous year data. Requesting developer team check possibility restoring it. I already sent email updated contact details.,Negative,0.16666666666666666
34267,Dictionary - Merriam-Webster,Best English dictionary problem pronounce words offline... So dictionary purpose make pronunciation correct.,Positive,0.15
34416,Digit Save Money Automatically,Useful,Positive,0.0
34456,Digit Save Money Automatically,Useful,Positive,0.0
34486,Digital Alarm Clock,I travel extensively odd work hours meaning day start anywhere clock alarm clock always local time operates independently hotel system basically immune power blips invaluable. Add I set colour ruin night vision wake tunes makes valuable travel app.,Negative,0.125
34547,Digital Alarm Clock,This Last Update The Works Better On My Phone But My Alarms That I Have Saved Switches From Regular Time To Military Time Even Though My Alarms Where Set In Military Time,Positive,0.1687179487179487
34551,Digital Alarm Clock,seems working fine now.just wish folders back picking alarm music instead scroll forever find favourite alarm track.apart alarm back fully functional..,Positive,0.16666666666666666
34600,Dil Mil,My phone restarts I thru Dil Mil consistent. Using Nexus 6!! Swipe left Previous photo never takes previous photo.,Positive,0.14583333333333331
34662,Dinosaur Simulator: Dino World,Greedy! Not worth time...,Negative,0.1
34855,Disney Magic Kingdoms: Build Your Own Magical Park,IT'S BARE DENCH BLUD,Positive,0.1
34895,Disney Magic Kingdoms: Build Your Own Magical Park,IT'S BARE DENCH BLUD,Positive,0.1
35109,Docs To Go™ Free Office Suite,"Waste time. Edit save file mobile, copying laptop running windows 8, file IS NOT accessible, even listed file manager. Perhaps BUGS.",Negative,0.1875
35600,Domino's Pizza USA,"The supposed to, thing annoys me. It offers option ""stay signed in"" checking box, never keeps signed in, remember log info.",Positive,0.0
35601,Domino's Pizza USA,I always get network lost cart loses saved item. This improved lot. The thing ia It save credentials I type password everytime even though I checked remember box,Negative,0.1
35811,Door Lock Screen,soo useful,Positive,0.0
35868,DoorDash - Food Delivery,Was forced pay 10 dollar subscription place order never went through. Waste time money.,Negative,0.1
35871,DoorDash - Food Delivery,Don't order app. Ordered food date arrived 3 HOURS early. Jesus Christ. Wasted bunch money.,Negative,0.15
35933,Down Dog: Great Yoga Anywhere,"I've pro member months, recognize purchase. I've reached customer THREE TIMES canned first response, replies second third emails. Give money back!",Positive,0.08333333333333333
35958,Dr. Oetker Rezeptideen,This is no German kitchen you are driving. This is all foreign and Americanized!,Negative,0.0625
36122,Dr. Panda Town: Vacation,It sucks deleted like 2 seconds later played almost everything need pay,Negative,0.15
37186,Droid Zap by Motorola,"Space waster Not useful, need default share pictures...",Negative,0.0
37198,DroidAdmin for Android - Advice,"Asks hyperlink above, hyperlink! Don't know I'm missing app. I Gave up. Uninstalled.",Negative,0.07500000000000001
37269,Dropbox,A useful Application,Positive,0.0
37309,Dropbox,A useful Application,Positive,0.0
37352,Drugs.com Medication Guide,Useful. I always doctor's office I fill paperwork asks prescriptions.,Positive,0.0
37435,Dude Perfect 2,"I'm Mizo I going say English .I want see real face face want come Mizoram ,If come Mizoram OmI wait",Positive,0.15000000000000002
37514,Dungeon Hunter Champions: Epic Online Action RPG,connection fail. much lag. im using octacore 4gb ram still lag. waste time,Negative,0.16666666666666666
37575,Duolingo: Learn Languages Free,"I stopped using I came back days ago I noticed update... Before While taking Spanish, would test ask write Spanish translation English sentence. But reason way testing anymore. I found way much appealing tough. Please bring back.",Positive,0.1904761904761905
37582,Duolingo: Learn Languages Free,"This decently made app. It glitches. The big I notice Irish lessons. For Spanish, Polish, I assume others, word pronounced picture. For Irish lessons, not. I learning read Irish, even close speaking properly. Other fun way learn. I'm interested see much I actually retain. Update: Irish pronouncing 90% words. French, Russian, Spanish, Polsih work well.",Positive,0.1386904761904762
37608,Duolingo: Learn Languages Free,"It helpful I learning Spanish. However, I need learn Thai. Thai speakers learn English English speakers cannot learn Thai. However, learn Klingon High Valyrian...gee that's helpful. What joke.",Positive,0.13499999999999998
37615,Duolingo: Learn Languages Free,"I stopped using I came back days ago I noticed update... Before While taking Spanish, would test ask write Spanish translation English sentence. But reason way testing anymore. I found way much appealing tough. Please bring back.",Positive,0.1904761904761905
37622,Duolingo: Learn Languages Free,"This decently made app. It glitches. The big I notice Irish lessons. For Spanish, Polish, I assume others, word pronounced picture. For Irish lessons, not. I learning read Irish, even close speaking properly. Other fun way learn. I'm interested see much I actually retain. Update: Irish pronouncing 90% words. French, Russian, Spanish, Polsih work well.",Positive,0.1386904761904762
37648,Duolingo: Learn Languages Free,"It helpful I learning Spanish. However, I need learn Thai. Thai speakers learn English English speakers cannot learn Thai. However, learn Klingon High Valyrian...gee that's helpful. What joke.",Positive,0.13499999999999998
37655,Duolingo: Learn Languages Free,"I stopped using I came back days ago I noticed update... Before While taking Spanish, would test ask write Spanish translation English sentence. But reason way testing anymore. I found way much appealing tough. Please bring back.",Positive,0.1904761904761905
37662,Duolingo: Learn Languages Free,"This decently made app. It glitches. The big I notice Irish lessons. For Spanish, Polish, I assume others, word pronounced picture. For Irish lessons, not. I learning read Irish, even close speaking properly. Other fun way learn. I'm interested see much I actually retain. Update: Irish pronouncing 90% words. French, Russian, Spanish, Polsih work well.",Positive,0.1386904761904762
37688,Duolingo: Learn Languages Free,"It helpful I learning Spanish. However, I need learn Thai. Thai speakers learn English English speakers cannot learn Thai. However, learn Klingon High Valyrian...gee that's helpful. What joke.",Positive,0.13499999999999998
37695,Duolingo: Learn Languages Free,"I stopped using I came back days ago I noticed update... Before While taking Spanish, would test ask write Spanish translation English sentence. But reason way testing anymore. I found way much appealing tough. Please bring back.",Positive,0.1904761904761905
37702,Duolingo: Learn Languages Free,"This decently made app. It glitches. The big I notice Irish lessons. For Spanish, Polish, I assume others, word pronounced picture. For Irish lessons, not. I learning read Irish, even close speaking properly. Other fun way learn. I'm interested see much I actually retain. Update: Irish pronouncing 90% words. French, Russian, Spanish, Polsih work well.",Positive,0.1386904761904762
37728,Duolingo: Learn Languages Free,"It helpful I learning Spanish. However, I need learn Thai. Thai speakers learn English English speakers cannot learn Thai. However, learn Klingon High Valyrian...gee that's helpful. What joke.",Positive,0.13499999999999998
37738,Duolingo: Learn Languages Free,"I stopped using I came back days ago I noticed update... Before While taking Spanish, would test ask write Spanish translation English sentence. But reason way testing anymore. I found way much appealing tough. Please bring back.",Positive,0.1904761904761905
37744,Duolingo: Learn Languages Free,I like app. I learned German months years Spanish. The thing I like go select language ( case look see language accidentally select language) makes choose new language take placement test move,Positive,0.15151515151515152
37747,Duolingo: Learn Languages Free,"This decently made app. It glitches. The big I notice Irish lessons. For Spanish, Polish, I assume others, word pronounced picture. For Irish lessons, not. I learning read Irish, even close speaking properly. Other fun way learn. I'm interested see much I actually retain. Update: Irish pronouncing 90% words. French, Russian, Spanish, Polsih work well.",Positive,0.1386904761904762
37778,Duolingo: Learn Languages Free,"I stopped using I came back days ago I noticed update... Before While taking Spanish, would test ask write Spanish translation English sentence. But reason way testing anymore. I found way much appealing tough. Please bring back.",Positive,0.1904761904761905
37784,Duolingo: Learn Languages Free,I like app. I learned German months years Spanish. The thing I like go select language ( case look see language accidentally select language) makes choose new language take placement test move,Positive,0.15151515151515152
37787,Duolingo: Learn Languages Free,"This decently made app. It glitches. The big I notice Irish lessons. For Spanish, Polish, I assume others, word pronounced picture. For Irish lessons, not. I learning read Irish, even close speaking properly. Other fun way learn. I'm interested see much I actually retain. Update: Irish pronouncing 90% words. French, Russian, Spanish, Polsih work well.",Positive,0.1386904761904762
37881,E*TRADE Mobile,"*Update* Junk App, junk app, I mention junk app. Trades wants to, buys wants to, charts work almost never. Called customer sent tech blamed phone (note5). Said fix keep uninstalling reinstalling, (yes tech said fix). Do favor find reliable broker! Junk App! Literally work e-trade!",Positive,0.1
38735,Easy Hair Style Design,M telling u waste data,Negative,0.0
38749,Easy Hair Style Design,It's useful app. I like,Positive,0.0
38796,Easy Installer - Apps On SD,"Not useful takes lot time.. This automatically install selected apps, install other...",Negative,0.1875
38813,Easy Installer - Apps On SD,Waste time Not working,Negative,0.0
38850,Easy Makeup Tutorials,I tot gonna tich 2 dro eyebrows scam I wish I waste data n tam,Negative,0.0
38879,Easy Origami Ideas,Doesn't proper steps old origami. Waste time,Negative,0.10000000000000002
38931,Easy Recipes,Kinda limited selection recipes,Negative,0.14285714285714285
38943,Easy Recipes,Clear comprehensive culinary delights.,Positive,0.19166666666666665
38975,Easy Voice Recorder,Useful,Positive,0.0
38996,EasyBib: Citation Generator,Elightcul useful. The name misleading but. The context I looking app. I could wish this. Thank you.,Positive,0.0
39057,Eat Fit - Diet and Health Free,"Didn't work. Wouldn't let get past configuration page. Kept saying ""error"" try later.",Negative,0.125
39061,Eat Fit - Diet and Health Free,This even work. Can't get past initial configuration.,Negative,0.125
39086,Eat Fit - Diet and Health Free,Missing tablets version,Negative,0.05
39191,EatStreet Food Delivery App,This useful helpful pain like,Positive,0.0
39221,"Ebates: Cash Back, Coupons, Rewards & Savings","Be aware Still problem credits.. They said take 3 days, still waiting.. And still waiting..first update Jun 7th. Last Update July 22nd. And never get anything yet.",Positive,0.15833333333333333
39226,"Ebates: Cash Back, Coupons, Rewards & Savings",Spent $100 Amazon still cash back supposed 5% cash back amazon. must work. Uninstalling. Just another lies cash back,Negative,0.025
39247,Ebook Reader,Used 5 stars last 2 days whenever go read book screen goes blank. I hope fixed change 5 stars,Positive,0.08888888888888889
39252,Ebook Reader,"Overall good ebook reader. Compatible multiple document ebook formats. However could consider adding option sync bookmarks etc., across devices people using multiple devices.",Positive,0.15000000000000002
39325,Edmodo,Putting password disaster half. I cant change avatar sometimes functioning well,Negative,0.16666666666666666
39346,Edmodo,This useful me..,Positive,0.0
39351,Edmodo,Very Useful,Positive,0.0
39362,Edmodo,"It's torturous teachers backstab homework outside school. Also, email notifications finicky best. Downloaded app? Godspeed.",Positive,0.175
39408,Educational Games for Kids,It useful childrens,Positive,0.0
39409,Educational Games for Kids,Less I expect,Negative,0.06666666666666668
40260,English-Myanmar Dictionary,I can not very well find some words about the form of double talk လေတွေ ပေးစေလိုပါတယ် !!,Negative,0.15
40264,English-Myanmar Dictionary,Thati's useful. Thank alots .,Positive,0.0
40270,English-Myanmar Dictionary,Preference is very useful,Positive,0.0
40274,English-Myanmar Dictionary,Useful me.thank much,Positive,0.1
40324,Entel,"The application has improved. But the design is to my liking, I preferred the design of the previous application, with material design style. However, it fulfills its purpose",Negative,0.16666666666666666
40504,Episode - Choose Your Story,It keeps freezing saying internet working. If working I writing review then? It also keeps restarting automatically. I recomend this. Its waste space,Negative,0.0
40507,Episode - Choose Your Story,"God knows what's problem go beyond first screen. I going back PUBG, Avakin Life Linda Brown",Positive,0.16666666666666666
40557,Epocrates Plus,I see worth upgrade cost,Positive,0.1
40676,Essential Anatomy 3,"Please please pleaseeeeeeee Download taking AnP class, I 3 minutes making difference already. The 11 dollars worth alone. Just deleted AnP 10 ones. THIS REPLACES THEM ALL!",Positive,0.1
40686,Essential Anatomy 3,"Is refund option? I realize would big difference 4th 3rd editions. I downloaded recommendation iPad user. I would like refund, 4th version becomes available tablet, I reinvest again.",Positive,0.16666666666666666
40716,Essential Anatomy 3,"Please please pleaseeeeeeee Download taking AnP class, I 3 minutes making difference already. The 11 dollars worth alone. Just deleted AnP 10 ones. THIS REPLACES THEM ALL!",Positive,0.1
40726,Essential Anatomy 3,"Is refund option? I realize would big difference 4th 3rd editions. I downloaded recommendation iPad user. I would like refund, 4th version becomes available tablet, I reinvest again.",Positive,0.16666666666666666
40942,Eurosport,This give us daily summary sport world simple way thanks,Positive,0.18571428571428567
40981,"Eve Period Tracker - Love, Sex & Relationships App",Very useful,Positive,0.0
40990,"Even - organize your money, get paid early",This success even link let sign workplace ughhhhh sooo moodd,Positive,0.0
41190,"Evernote – Organizer, Planner for Notes & Memos","I used iPhone ..and never problems app. Now I Samsung note 8. I edit notes. The freezes everyone I try edit notes. So mostly useless go. I actually create notes Samsung, send laptop copy paste evernote laptop. Waste time I'm paying user. Please fix Evernote!!!!!!",Negative,0.10000000000000002
41230,"Evernote – Organizer, Planner for Notes & Memos","I used iPhone ..and never problems app. Now I Samsung note 8. I edit notes. The freezes everyone I try edit notes. So mostly useless go. I actually create notes Samsung, send laptop copy paste evernote laptop. Waste time I'm paying user. Please fix Evernote!!!!!!",Negative,0.10000000000000002
41262,"Evernote – Organizer, Planner for Notes & Memos","wrote better part essay, tabed check definition word. tabbed back in, threw back maim screen, lost half essay.",Positive,0.16666666666666666
41422,"Expedia Hotels, Flights & Car Rental Travel Deals",Multi-city option missing fix issue,Negative,0.05
41462,"Expedia Hotels, Flights & Car Rental Travel Deals",Multi-city option missing fix issue,Negative,0.05
41502,"Expedia Hotels, Flights & Car Rental Travel Deals",Multi-city option missing fix issue,Negative,0.05
41781,Extreme Match,Hours non stop action!!,Positive,0.1
42019,FBReader: Favorite Book Reader,"Lit app, convenient useful",Positive,0.0
42064,FERZU - Furries Social Network,"Over going well thing I can't stand adds block menu icons go profile,chats, furrs exstra......it needs addressed makes harder",Negative,0.0
42109,"FIFA - Tournaments, Soccer News & Live Scores",Just uninstalled piece garbage Fifa prepare basic thing ocasion... Should get red card disgrace... We need previous guy back lead fifa Platini and Blatter,Negative,0.07291666666666666
42149,"FIFA - Tournaments, Soccer News & Live Scores",Just uninstalled piece garbage Fifa prepare basic thing ocasion... Should get red card disgrace... We need previous guy back lead fifa Platini and Blatter,Negative,0.07291666666666666
42216,FOSSIL Q: DESIGN YOUR DIAL,install Smartwatch worth need customer help install help whatsoever without manual like,Positive,0.1
42246,FOX,"Crashes time, works seamless chromecast always try twice watch anything",Positive,0.1
42261,FOX,"few options, nor can it download episodes",Negative,0.1
42286,FOX,"Crashes time, works seamless chromecast always try twice watch anything",Positive,0.1
42301,FOX,"few options, nor can it download episodes",Negative,0.1
42466,"FOX Sports: Live Streaming, Scores & News",Missed 2nd half world cup game said video content unavailable.....,Negative,0.18888888888888888
42473,"FOX Sports: Live Streaming, Scores & News",Overall solid sports everyone. Having ability listen shows podcasts best feature.,Positive,0.13333333333333333
42849,Facebook,"Has marketplace icon account. Wife access account using phone, I know issue phone. Googled TONS people issue nobody really knows solve looks like developers care less.",Positive,0.13333333333333333
