,App,Translated_Review,Sentiment,Sentiment_Subjectivity
42882,Facebook,"My Facebook, hacked. I limited access. Help.",Negative,0.14285714285714285
42919,Facebook,"Is fb there? It's really starting annoy me. I can't view comments without post back again, least three four times, even sometimes work. It refreshes u want to. And times shows posts week ago nothing newer. Then show adverts old posts I've already seen occasional new post. Think I may go back fb lite",Negative,0.18279220779220776
42934,Facebook,"Newsfeed shows posts two weeks ago. Have PC see recent posts. Also, I keep getting notifications going phone every time someone comments someone else's post. I go Android settings block notifications get stop. Third, removed ability turn sounds. The developer noob know fix it. Use Twitter instead. Edit: still fixed update.",Positive,0.15
42981,Facebook Ads Manager,Don't waste time money trash,Negative,0.0
42987,Facebook Ads Manager,Don't waste time,Negative,0.0
43021,Facebook Lite,"can't login cause sms code received, disable 2 way authentication via pc first. try login via fb lite. find another problem. since there's home button, can't vie newsfeed deleting post. back button show error",Positive,0.16666666666666666
43066,Facebook Local,Did show thing I wanted see literally show anything read going outside town. Totally useless,Negative,0.125
43069,Facebook Local,"The location way off! I missed many local events. Going back events via FB, going anymore.",Positive,0.16666666666666666
43149,Facetune - Ad Free,"The iOS version PAID FOR 3 options reshaping tool. The Android Version PAID FOR Not third option shape like iOS version , I paid option thinking across board .app useless",Negative,0.1
43189,Facetune - Ad Free,"The iOS version PAID FOR 3 options reshaping tool. The Android Version PAID FOR Not third option shape like iOS version , I paid option thinking across board .app useless",Negative,0.1
43386,Fake Call - Fake Caller ID,"Its worth less app,",Positive,0.08333333333333334
43429,Fake Call - Fake Caller ID,Useful friends beleibed someone calling,Positive,0.0
43452,Fake Call - Fake Caller ID,I really like actually works,Positive,0.15000000000000002
43543,Family Dollar,Glitchy work half time. Someone needs debug crappy,Negative,0.16666666666666666
43572,Family Dollar,"This would got 5 stars month ago. But coupon time could 2 time. The time I ""have spend less like it. Ease = meh ; taking 20 mins 40 coupons.",Negative,0.06666666666666668
43725,Family Locator - GPS Tracker,useful!,Positive,0.0
43728,Family Locator - GPS Tracker,useful,Positive,0.0
43832,FamilySearch Tree,A useful,Positive,0.0
44221,Fantasy Football & NFL News,Has minor bugs overall job,Negative,0.1
44709,Fashion in Vogue,Don't waste time even work,Negative,0.0
44749,Fashion in Vogue,Don't waste time even work,Negative,0.0
44789,Fashion in Vogue,Don't waste time even work,Negative,0.0
44873,Fast Scanner : Free PDF Scan,It useful need get digital document single file.,Positive,0.07142857142857142
44913,Fast Scanner : Free PDF Scan,It useful need get digital document single file.,Positive,0.07142857142857142
44940,Fast Secure VPN,"The server of ""China-Beijing"" was finally fixed. However, the network is slightly unstable and hopes to improve, thank you!",Negative,0.18333333333333332
44976,Fast Secure VPN,This designer scammer paid VIP level I can't connect internet refunded money.Take care costumers scammer.Google play store take action owner.,Positive,0.1
44996,Fast Secure VPN,"Useless China, waste money",Negative,0.1
45016,Fast Secure VPN,This wasted people time,Negative,0.0
45107,Fat Burning Workout - Home Weight lose,Invasive ads I'm using ruined me. Take would worth damn!,Positive,0.1
45118,Fat Burning Workout - Home Weight lose,This exactly I've looking for! Did preview watch seems doable well worth workout!,Positive,0.175
45548,Files Go by Google: Free up space on your phone,"Less hands-on CCleaner example.. Google, Android, works background occasionally asks want delete stuff need. You customise ask often etc. Exactly I need ""disk cleanup"" app.",Positive,0.14722222222222225
45603,FilterGrid - Cam&Photo Editor,"Waste app, opens install, first time user , 10 secs opened 3 install zero button load existing pics",Positive,0.16666666666666666
46084,Find&Save - Local Shopping,"When first started I earning something between, went thru several months nothing get earning. Lately big box stores, stores I earn with.",Positive,0.14444444444444446
46097,Find&Save - Local Shopping,Need offers beginning first join several offers. Now months they've two offers Best Buy World Market.,Positive,0.10555555555555557
46098,FindShip,I used long time last week cannot see anything. It displayed google play services updating. I uninstalled reinstall several times still same. Pls fix let know. Tq,Negative,0.14791666666666667
46105,FindShip,Cannot lock subscription last week! What problem? I need movements every single day. Please attend. Thank,Negative,0.14047619047619048
46107,FindShip,Slow update! Shows movement boat I'm following even though vessel way. Last position 28 hours old.,Negative,0.19166666666666665
46123,FindShip,"Loses track vessels often, AIS sync.",Negative,0.1
46711,Flashlight & LED Torch,Extremely useful,Positive,0.0
46812,Flickr,I Flickr pics would really useful I could arrange albums order place ...,Positive,0.0
46820,Flickr,"It's weeks since I uploaded small batch photos. They're still showing camera roll, also blank public view albums. If cannot perform basic function, exists?",Negative,0.14791666666666667
46852,Flickr,I Flickr pics would really useful I could arrange albums order place ...,Positive,0.0
46936,Flightradar24 Flight Tracker,I bought alot stuff unlocked says old updated since 2016 guys asking monthly subscription?i dont want old app! This scam want money back paid for!,Positive,0.13333333333333333
46978,Flights,I multiple phone. This finds best results.,Positive,0.15
46985,Flights,"I mistook Google Flights. After several searches, I realized results match. All fairs much lower look like dodgey booking sites.",Positive,0.1
47208,Flipkart Online Shopping App,I regular customer flipkart always gives best deals,Positive,0.18846153846153849
47232,Flipkart Online Shopping App,Delivery time less,Negative,0.06666666666666668
47451,Flow Free,"The game like 4 5 star worth game every time completing board, next board button spot, so, course, get used clicking spot. Well every 7n awhile exact spot, 'watch ad' button appears next level button gets moved every then, accidentally it. I feel like done intentionally.",Negative,0.19166666666666665
47491,Flow Free,"The game like 4 5 star worth game every time completing board, next board button spot, so, course, get used clicking spot. Well every 7n awhile exact spot, 'watch ad' button appears next level button gets moved every then, accidentally it. I feel like done intentionally.",Negative,0.19166666666666665
47531,Flow Free,"The game like 4 5 star worth game every time completing board, next board button spot, so, course, get used clicking spot. Well every 7n awhile exact spot, 'watch ad' button appears next level button gets moved every then, accidentally it. I feel like done intentionally.",Negative,0.19166666666666665
47631,Flow Free,"The game like 4 5 star worth game every time completing board, next board button spot, so, course, get used clicking spot. Well every 7n awhile exact spot, 'watch ad' button appears next level button gets moved every then, accidentally it. I feel like done intentionally.",Negative,0.19166666666666665
47781,FollowMyHealth®,"My biggest issue is, attempting set 2nd device (tablet) accept password. I've reset password hoping would work, still nothing. And I already account I using years, I would think password would open APP. Oh please write others tell ""Contact medical organization technical support "". Last time I checked business (human health do) supposed dealing tech support. Respectfully Mr Black",Negative,0.17142857142857146
47798,FollowMyHealth®,"I get ton messages junk mail ap. The clinic sends ""updates"" ALL time. It runs battery extra stuff buries might actually useful.",Positive,0.05
47804,FollowMyHealth®,"I 3 months.; It worked first week. Since them, soon I log in, blank white screen",Positive,0.1111111111111111
47812,FollowMyHealth®,"Re-installed year dumping see improved. Well suspected, still really sucks. l still say, builders go back school learn design properly. thing l see doctor visits. vitals results. If 0 5 rating, l give (0). I AM REMOVING IT. Totally useless, never updates less 2 3 years.",Negative,0.13333333333333336
47821,Font Studio- Photo Texts Image,"Barely worth & mind hit w/ ads every clicks. Hint: Disable Wi-Fi using spare frustration... plus, screws maker revenue. They deserve it.",Positive,0.1
47825,Font Studio- Photo Texts Image,Can even finish 1 edit without fight 3 ads per click. If patience go it. I left alone. It'll take hour edit 5 minute photo due ad spamming,Negative,0.1875
47836,Font Studio- Photo Texts Image,"Its s**t app, even bother waste data downloading nonsense, even edit single photo, see templates... It deserves removed play store.",Negative,0.10714285714285714
47912,Food Network,Here go again. Continually sign providers listed. You would think year they'd figure out. Have uninstalled reinstalled multiple times problem. useless.,Negative,0.1
47918,Food Network,"Why I uncast TV sign opposite watch another episode? You really, really need fix issue asking much.",Positive,0.13333333333333333
47952,Food Network,Here go again. Continually sign providers listed. You would think year they'd figure out. Have uninstalled reinstalled multiple times problem. useless.,Negative,0.1
47958,Food Network,"Why I uncast TV sign opposite watch another episode? You really, really need fix issue asking much.",Positive,0.13333333333333333
48059,"Foot Mercato : transferts, résultats, news, live","If I do not look at the items for a day, when I look at the last one or I stopped, and those look at the next one, it automatically returns to the first items. I must then go down to find where I was. I put 5 stars as soon as the problem is corrected",Positive,0.17222222222222222
48137,ForecaWeather,Useful.,Positive,0.0
48163,Fortune City - A Finance App,Thank u making financial management fun. Keeps coming back.,Positive,0.06666666666666668
48194,Fortune City - A Finance App,Useful give motivation write note.,Positive,0.0
48196,Fortune City - A Finance App,Very useful see spending habits.,Positive,0.0
48205,Fortune City - A Finance App,"Very helpful, useful, actually fun",Positive,0.16666666666666666
48543,Foursquare City Guide,Useful app. Use everywhere I go find sorts places (not restaurants),Positive,0.0
48556,Foursquare Swarm: Check In,"After last update, I can't upload photo checked in. C'mon guys, really want to?",Positive,0.13333333333333333
48680,"Fox News – Breaking News, Live Video & News Alerts","The last couple weeks keeps aborting Galaxy 9+. Sent feed back everytime, fix yet. 7/30/18 update. The new version still crashes installing it.",Positive,0.17373737373737375
48720,"Fox News – Breaking News, Live Video & News Alerts","The last couple weeks keeps aborting Galaxy 9+. Sent feed back everytime, fix yet. 7/30/18 update. The new version still crashes installing it.",Positive,0.17373737373737375
48788,Free & Premium VPN - FinchVPN,I rate 4 stars Anti DPI servers useful country.,Positive,0.0
48995,Free Dating & Flirt Chat - Choice of Love,Waste time,Negative,0.0
49007,Free Dating & Flirt Chat - Choice of Love,Do waste time get catfished,Negative,0.0
49014,Free Dating & Flirt Chat - Choice of Love,No anybody reply here. Time waste,Negative,0.0
49024,Free Dating & Flirt Chat - Choice of Love,Waste time,Negative,0.0
49073,Free Dating App & Flirt Chat - Cheers,This missing alot... including pictures person talking to...,Negative,0.05
49129,Free Dating App - Meet Local Singles - Flirt Chat,As anyone well aware of. These sites magnet fore anyone deviant plans A Financial windfall. Inheritance Ghana. Two red flags. Ive followed similar Sights results.,Positive,0.1625
49169,Free Dating App - Meet Local Singles - Flirt Chat,As anyone well aware of. These sites magnet fore anyone deviant plans A Financial windfall. Inheritance Ghana. Two red flags. Ive followed similar Sights results.,Positive,0.1625
49210,"Free Dating App - YoCutie - Flirt, Chat & Meet",I seen exact 50 profiles last 7 times I logged on...,Positive,0.15833333333333333
49384,Free Foreclosure Real Estate Search by USHUD.com,"Garbage. Won't even get past County section searching. If hit back button, it'll give menu, features ""to added"".",Negative,0.125
49394,Free Foreclosure Real Estate Search by USHUD.com,"Might useless software ever. Won't even launch properly, gives search error startup.",Negative,0.15000000000000002
49399,Free Foreclosure Real Estate Search by USHUD.com,What waste time. Keep crashing. Everytime run runs scratch.,Negative,0.0
49455,Free Live Talk-Video Call,Don't time spent,Negative,0.1
49765,"Free phone calls, free texting SMS on free number",So didnt recieve points 3 things phone get points. Then try update info points tried twice. No points updated info. Its become harder harder use. Dont tell call times can't answer due screen lock password protected. Please fix would easier.,Negative,0.125
49929,Fresh EBT - Food Stamp Balance,This life saver. Half time I throw away receipt,Negative,0.16666666666666666
49957,Fresh EBT - Food Stamp Balance,I less week stopped working.,Negative,0.06666666666666668
50048,Frontback - Social Photos,time waste,Negative,0.0
50059,Frontback - Social Photos,Waste,Negative,0.0
50540,Fuelio: Gas log & costs,Come back edit review. The developer added E20 app. Now best fuel log ever.,Positive,0.15
50548,Fuelio: Gas log & costs,Very useful monitoring fuel efficiency summary expenses. Thank app.,Positive,0.0
50552,Fuelio: Gas log & costs,Very useful tracking much fuel much spend fuel.,Positive,0.13333333333333333
50600,Fuelio: Gas log & costs,Very useful,Positive,0.0
50658,Full Screen Caller ID,Old dialer comes back making phone call,Positive,0.1
51128,GMAT Math Flashcards,So useful.. Thanks creating magoosh,Positive,0.1
51146,GMAT Question Bank,"Very confusing After sign up, ask first name, u text box nothing happens. Press back goes sign screen, customer know register move cursor text box. 2ndly I clicked start quiz taking time load, back button enable keep pressing back button u reach sign screen loader image screen. M using Nexus 5, OS Android 6.",Negative,0.14222222222222222
51175,GMAT Question Bank,I'd like know questions questions online question bank Veritas offers,Positive,0.0
51629,GPS Status & Toolbox,"Makes unreliable GPS almost usable. Still takes bit get initial position lock, I get dropped signal navigation much less often now.",Negative,0.03333333333333333
51632,GPS Status & Toolbox,I installed search GPS never gave useful information,Positive,0.0
51643,GPS Status & Toolbox,Not useful,Negative,0.0
51649,GPS Status & Toolbox,"Neat, simple useful additional data display.",Positive,0.17857142857142858
51666,GPS Traffic Speedcam Route Planner by ViaMichelin,Very useful comprehensive,Positive,0.0
51702,GPS Traffic Speedcam Route Planner by ViaMichelin,"Couldn't log app, save routes. The facility there... But work. And trying basic logged mode, recognize Bluetooth speaker bike helmet crashes often. Not useful navigating.",Negative,0.0625
51780,GRE Prep & Practice by Magoosh,Very useful prepare GRE.,Positive,0.0
51807,GRE Tutor,"Epitome success! If used correctly, app's algorithms & word scope guarantee rapid increase vocabulary record time.",Positive,0.0
51826,GS SHOP,English Translation It's better english language.,Positive,0.16666666666666666
51831,GS SHOP,"Please English Please English Russian. Good ,but can't it.",Positive,0.15000000000000002
51847,GS SHOP,English please. Please provide option change language Korean English. Many expat living Korea would like buy GS...,Positive,0.16666666666666666
51895,GUNSHIP BATTLE: Helicopter 3D,I crossed 28 mission..pls add mission ..Bullets costly..and level reward price money less missile pls increase gun power.,Negative,0.06666666666666668
51948,Galaxy Attack: Alien Shooter,I spent bunch money game. Lost since I switch phones save option save levels crystals purchases. Can't find restore purchases either. I find way get money back speak lawyers.,Negative,0.16666666666666666
51956,Galaxy Attack: Alien Shooter,I much like game year ago I deleted I spent lot money I'm playing I wish I could get money back least spaceship back...,Negative,0.18333333333333332
51988,Galaxy Attack: Alien Shooter,I spent bunch money game. Lost since I switch phones save option save levels crystals purchases. Can't find restore purchases either. I find way get money back speak lawyers.,Negative,0.16666666666666666
51997,Galaxy Attack: Alien Shooter,I much like game year ago I deleted I spent lot money I'm playing I wish I could get money back least spaceship back...,Negative,0.18333333333333332
52030,Galaxy Attack: Alien Shooter,I spent bunch money game. Lost since I switch phones save option save levels crystals purchases. Can't find restore purchases either. I find way get money back speak lawyers.,Negative,0.16666666666666666
52039,Galaxy Attack: Alien Shooter,I much like game year ago I deleted I spent lot money I'm playing I wish I could get money back least spaceship back...,Negative,0.18333333333333332
52299,"Gametime - Tickets to Sports, Concerts, Theater",I find useful! I always buy tickets gametime.,Positive,0.0
52614,Gardenscapes,"I've number highest rugby league two weeks. The rewards underwhelming. I way items stay number receive less 10 percent back I used. There better reward system that. I allowed keep unused items I beat level something. I'm level 1546 nothing changes, I'm going continue playing. The rewards worth point. Smh",Positive,0.16666666666666666
52898,Garmin Connect™,"It's useful but, I find friends connections updated. Hope fix it…!",Positive,0.0
52955,GasBuddy: Find Cheap Gas,"Why big??? The old much faster, I think easier use.",Positive,0.16666666666666666
53164,Genius Scan - PDF Scanner,"I regularly scanning things go creating multipage pdfs. Occasionally pages change orientation scanned appear B&W (perhaps inadvertently something cause this) easily fixed editing. Simple, practical",Positive,0.1897664835164835
54125,GoPro (formerly Capture),Samsung s8 paired hero 5 session doesn't work.. connect camera. Wasted hours without progress. And looking reviews wont even bother responding.,Negative,0.0
54130,GoPro (formerly Capture),"Purchased GoPro Hero 5 Session makes camera absolutely useless. Takes ages connect, lose connectivity regularly, glitches midway recording. Returned camera retailer. Very dissapointing GoPro market leaders.",Negative,0.1923076923076923
54274,Gold Butterfly Keyboard Theme,Very useful,Positive,0.0
54311,Golden Dictionary (EN-AR),It useful,Positive,0.0
54322,Golden Dictionary (EN-AR),Very useful Internet,Positive,0.0
54336,Golden Dictionary (EN-AR),Very useful. app.,Positive,0.0
54359,Golden Launcher,A useful,Positive,0.0
54473,Golf GPS Rangefinder: Golf Pad,The GPS spot middle green. The club selection helpful improving selection.,Negative,0.15
54492,Golf GPS Rangefinder: Golf Pad,"I really like keeping track rounds stats sharing social media. I went ahead also got Golf Tags attach clubs saves enter shots manually. I also like Samsung Gear I glance watch, though minor bug always switch back distance display. Fix 5 stars.",Positive,0.11666666666666667
54515,Golf GPS by SwingxSwing,Best gps/ scorekeeping i've found yet. Just wish calculated handicap British style USGA style.,Positive,0.15
54541,Golf GPS by SwingxSwing,"back working syncing lg watch , best golf gps scoring opinion . thank",Positive,0.15
54664,Golfshot: Golf GPS + Tee Times,Would work Android tablet! Could enter scores per hole show give yardage hole graphics. Don't waste time money app!,Negative,0.0
54704,Golfshot: Golf GPS + Tee Times,Would work Android tablet! Could enter scores per hole show give yardage hole graphics. Don't waste time money app!,Negative,0.0
54804,Google,This useful......,Positive,0.0
54836,Google Ads,All that's missing MCC view see accounts,Negative,0.05
54876,Google Ads,All that's missing MCC view see accounts,Negative,0.05
55711,Google Duo - High Quality Video Calls,Best quality video app. I used WhatsApp video calling used disconnect lot. Later I moved Duo never faced issue disconnection.,Positive,0.15
55741,Google Earth,"For corporation trying help save earth, surely wants update device...simply said...it work. Crashes zoom in, start over. If older device...don't waste time.",Positive,0.14444444444444446
55989,Google My Business,This useful..,Positive,0.0
56000,Google My Business,Useful business,Positive,0.0
56029,Google My Business,This useful..,Positive,0.0
56040,Google My Business,Useful business,Positive,0.0
56069,Google My Business,This useful..,Positive,0.0
56080,Google My Business,Useful business,Positive,0.0
56111,Google News,"After recent issue keeps jumping around. You read article, return main view suddenly back top feed, usually to. Select article. You end opening article multiple times takes forever scroll back were. Sometimes article wanted read gone",Positive,0.19047619047619047
56152,Google News,"After recent issue keeps jumping around. You read article, return main view suddenly back top feed, usually to. Select article. You end opening article multiple times takes forever scroll back were. Sometimes article wanted read gone",Positive,0.19047619047619047
56192,Google News,"After recent issue keeps jumping around. You read article, return main view suddenly back top feed, usually to. Select article. You end opening article multiple times takes forever scroll back were. Sometimes article wanted read gone",Positive,0.19047619047619047
56213,Google PDF Viewer,"All star reviewers missing point. This lightweight minimalist add-on launches file manager, heavyweight loaded features. It covers basics well. Would people complain bicycle four wheels???",Negative,0.05
56214,Google PDF Viewer,A simple efficient pdf viewer. Doesn't consume much space. But there's problem. I much internal stotage left I moved external storage stopped working. So I moved back internal storage.,Positive,0.09387755102040816
56253,Google PDF Viewer,"All star reviewers missing point. This lightweight minimalist add-on launches file manager, heavyweight loaded features. It covers basics well. Would people complain bicycle four wheels???",Negative,0.05
56254,Google PDF Viewer,A simple efficient pdf viewer. Doesn't consume much space. But there's problem. I much internal stotage left I moved external storage stopped working. So I moved back internal storage.,Positive,0.09387755102040816
56422,Google Photos,"Right, I went swimming I got back data warning saying I 100mbs left. So I looked device said Google photos used 652mbs data. For may alot I get gigabyte month!",Positive,0.17857142857142858
56440,Google Photos,"Forced Android phone. When I send photo someone else, automatically gives email without permission. Having difficulty downloading photos save computer back hard drive. The ""cloud"" I want, useful me.",Negative,0.18541666666666667
56462,Google Photos,"Right, I went swimming I got back data warning saying I 100mbs left. So I looked device said Google photos used 652mbs data. For may alot I get gigabyte month!",Positive,0.17857142857142858
56481,Google Photos,"Forced Android phone. When I send photo someone else, automatically gives email without permission. Having difficulty downloading photos save computer back hard drive. The ""cloud"" I want, useful me.",Negative,0.18541666666666667
56502,Google Photos,"Right, I went swimming I got back data warning saying I 100mbs left. So I looked device said Google photos used 652mbs data. For may alot I get gigabyte month!",Positive,0.17857142857142858
56521,Google Photos,"Forced Android phone. When I send photo someone else, automatically gives email without permission. Having difficulty downloading photos save computer back hard drive. The ""cloud"" I want, useful me.",Negative,0.18541666666666667
56535,Google Photos,"Right, I went swimming I got back data warning saying I 100mbs left. So I looked device said Google photos used 652mbs data. For may alot I get gigabyte month!",Positive,0.17857142857142858
56546,Google Photos,"Forced Android phone. When I send photo someone else, automatically gives email without permission. Having difficulty downloading photos save computer back hard drive. The ""cloud"" I want, useful me.",Negative,0.18541666666666667
56552,Google Photos,"Why add damn FOLDERS? IF I backup images phone, I store organize things image folders (I name accordingly.), I want Google Photos respect ALSO HAVE *SAME* FOLDERS, instead grouping pics single Album....",Negative,0.16964285714285715
57111,Google Trips - Travel Planner,Useful,Positive,0.0
57467,Graphing Calculator,Saved money This useful college level math class. The graphing section flexible equations put simplifying & changing around forces algebraic skills.,Positive,0.0
57485,Graphing Calculator,"Graphics and layout Graphics, keyboard layout, display is limited.",Negative,0.14285714285714285
57531,Graphing Calculator,It useful calculating multifunction plotting.,Positive,0.0
57532,Graphing Calculator,It's useful! Thank you!,Positive,0.0
57592,Groovebook Photo Books & Gifts,"My february pics print, stuck 104 pics. The allowing go back take pics off. When try print, error pop box tell 96 pics loaded need load 4 pics. Please change load pics. My phone loading pics. Thanks!!",Positive,0.1
